{
  "jobs": [
    {
      "id": "J1",
      "operations": [
        { "id": "J1-O1", "duration": 3, "resources": ["M1"], "predecessors": [] },
        { "id": "J1-O2", "duration": 2, "resources": ["M2"], "predecessors": ["J1-O1"] }
      ],
      "release": 0,
      "due": 10
    },
    {
      "id": "J2",
      "operations": [
        { "id": "J2-O1", "duration": 2, "resources": ["M1"], "predecessors": [] },
        { "id": "J2-O2", "duration": 4, "resources": ["M2"], "predecessors": ["J2-O1"] }
      ],
      "release": 0,
      "due": 12
    }
  ],
  "resources": [
    { "id": "M1", "capacity": 1 },
    { "id": "M2", "capacity": 1 }
  ],
  "objective": "makespan",
  "time_limit_sec": 5,
  "replan_window": { "start": 2, "end": 8 },
  "baseline_schedule": [
    { "operation_id": "J2-O1", "resource_id": "M1", "start": 0, "end": 2 },
    { "operation_id": "J1-O1", "resource_id": "M1", "start": 2, "end": 5 },
    { "operation_id": "J2-O2", "resource_id": "M2", "start": 2, "end": 6 },
    { "operation_id": "J1-O2", "resource_id": "M2", "start": 6, "end": 8 }
  ]
}
